{
    "state_abbreviation": "ak",
    "slug": "alaska",
    "title": "Alaska",
    "important_dates": [
        {
            "date": "09-01-2019",
            "date_type": "Voter Registration Deadline"
        },
        {
            "date": "09-16-2019",
            "date_type": "Absentee Ballot Request Deadline"
        },
        {
            "date": "09-23-2019",
            "date_type": "Absentee Ballot Return Deadline"
        },
        {
            "date": "09-23-2019 to 09-27-2019",
            "date_type": "Early Voting/ In Person Absentee Voting"
        },
        {
            "date": "10-01-2019",
            "date_type": "Election"
        }
    ]
}
